{
  "version": "agentkernel.execution/v0.2",
  "execution_id": "exec-minimal-1",
  "attempt_id": "attempt-1",
  "seq": 4,
  "kind": "tool.executed",
  "observed_at": "2026-10-07T12:00:03Z",
  "source": "kernel.tools",
  "detail": "file.read src/main.go",
  "tool_call": "call-1",
  "grant": "read-all",
  "ref": {"digest": "sha256:c7c5c1d70c5dec4416ab6158afd0b223ef40c29b1dc1f97ed9428b94d4cadb1c", "size": 8, "media_type": "text/plain", "producer": "tool:file.read"},
  "usage": {"input": null, "output": null, "cached_input": null, "cache_write_input": null}
}
